{
  "schemaVersion": "1.0.0",
  "streamKind": "retention",
  "aggregateId": "11111111-1111-4111-8111-111111111111",
  "highWaterRevision": 1,
  "eventCount": 1,
  "streamDigest": "a2bbb4c1dc869bfc3abf17f718f4611464bb8a9ddb8ea95aa3e843ac7feaf926",
  "databaseSnapshotToken": "9cae632643ff7a37e4906a3e300b69e2a5a7322e4f91e9ad13af1631eba08de6",
  "serializableReadAt": "2026-07-21T00:00:05.250Z"
}
